{
  "$schema": "https://json-schema.org/draft/2020-12/schema",
  "$id": "https://cadet-agent.dev/state-v4.json",
  "title": "Cadet-Agent Session State",
  "description": "Tracks workflow progress across a session. v2 added evidence-backed gates, the active run/work item, and legal transition metadata. v3 added strict closure, manual-confirmation quality fields, and a gate-exception taxonomy (opt-in via `strictClosure.enabled`). v4 moves evidence history out of this document: `gateEvidence` keeps only the active work item, `evidenceCoverage` indexes what left, gate exceptions get their own field, and `changeHistory` is retired — history lives in commit trailers (see gitmemo.mjs / HarnessContract-v5.md) and `.cadet/archive/`. v1-v3 documents remain readable and are migrated by `cadet-agent state migrate --to 4`.",
  "type": "object",
  "required": ["version", "session", "epics"],
  "$defs": {
    "gateException": {
      "type": "object",
      "description": "A scoped, expiring exception that permits a gate to be treated as satisfied without fresh evidence. Live state, not history: it is bounded by `expiresAt` and read by `activeExceptions`.",
      "required": ["gate"],
      "properties": {
        "type": { "type": "string", "const": "gate-exception" },
        "gate": { "type": "string" },
        "scope": {
          "oneOf": [
            { "type": "string" },
            { "type": "array", "items": { "type": "string" } }
          ],
          "description": "The work item id(s) this exception covers. An exception scoped to another work item never excuses the active one."
        },
        "category": {
          "type": "string",
          "enum": [
            "manual-compile", "budget-override", "analyzer-fallback", "unscoped-freshness",
            "documentation-only", "tooling-gap", "pre-harness-story", "non-user-facing"
          ],
          "description": "v3: required on a gate-exception under strictClosure. Determines the default expiry window and whether closureReviewNote is required. The set must match EXCEPTION_CATEGORIES in policy.mjs."
        },
        "rationale": { "type": "string" },
        "reason": { "type": "string", "description": "v3: why the exception was needed. Strict closure only." },
        "date": { "type": "string", "format": "date-time" },
        "createdAt": { "type": "string", "format": "date-time" },
        "expiresAt": { "type": ["string", "null"], "format": "date-time" },
        "closureReviewNote": {
          "type": "string",
          "description": "v3: who accepted this exception and what would change that judgement. Required for categories that are not documentation-only. Strict closure only."
        },
        "expiryExtendedReason": {
          "type": "string",
          "description": "v3: required when the exception expires beyond its category default."
        }
      }
    },
    "evidenceCoverageRow": {
      "type": "object",
      "description": "v4: what survives compaction for one work item. It is what keeps the 'a done story owns evidence' check answerable once the records themselves have been archived or sealed into commits.",
      "required": ["recordCount"],
      "properties": {
        "workItemId": { "type": "string" },
        "recordCount": { "type": "integer", "minimum": 0 },
        "gates": { "type": "array", "items": { "type": "string" } },
        "firstAt": { "type": ["string", "null"], "format": "date-time" },
        "lastAt": { "type": ["string", "null"], "format": "date-time" },
        "sealedCommit": {
          "type": ["string", "null"],
          "pattern": "^[0-9a-fA-F]{4,40}$",
          "description": "The commit whose trailers carry this work item's evidence, or null when it was archived rather than sealed."
        }
      }
    }
  },
  "properties": {
    "version": {
      "type": "integer",
      "enum": [1, 2, 3, 4],
      "description": "Schema version. v1 is gate-only; v2 adds gateEvidence, activeRunId, activeWorkItem, and lastTransition. v3 adds strict closure, manual-confirmation quality fields, and a gate-exception taxonomy — all opt-in via `strictClosure.enabled`, so a v2 document remains valid and is not retroactively invalidated. v4 scopes `gateEvidence` to the active work item, adds `evidenceCoverage` and `gateExceptions`, and retires `changeHistory`."
    },
    "stateVersion": {
      "type": "integer",
      "enum": [2, 3, 4],
      "description": "Present on v2/v3/v4 documents. Redundant with version for tooling that reads stateVersion first."
    },
    "session": {
      "type": "object",
      "required": ["workflowPath", "currentPhase", "trackingMode"],
      "properties": {
        "trackingMode": {
          "type": "string",
          "enum": ["markdown", "github"],
          "default": "markdown",
          "description": "How work is tracked. markdown: epic/story markdown files in directories. github: GitHub Projects/Issues for story tracking."
        },
        "learnerTier": {
          "type": "string",
          "enum": ["beginner", "intermediate", "advanced", "guided"],
          "description": "Resolved learner tier for this session"
        },
        "operatingMode": {
          "type": "string",
          "enum": ["instruction-first", "implementation-first", "hybrid"],
          "description": "Operating mode for this session"
        },
        "workflowPath": {
          "type": "string",
          "enum": ["large", "small", "no_test_required"],
          "description": "Classified change size"
        },
        "currentPhase": {
          "type": "string",
          "enum": [
            "context-resolution",
            "requirements",
            "requirementsComplete",
            "architecture",
            "architectureComplete",
            "spikes",
            "story-breakdown",
            "implementation",
            "review",
            "validation",
            "closed"
          ],
          "description": "Current SDLC phase. The review phase is a mandatory gate between implementation and validation — it cannot be skipped."
        }
      }
    },
    "epics": {
      "type": "object",
      "description": "Epic status keyed by epic directory name",
      "additionalProperties": {
        "type": "object",
        "required": ["status", "stories"],
        "properties": {
          "status": {
            "type": "string",
            "enum": ["planned", "in-progress", "complete"]
          },
          "stories": {
            "type": "object",
            "description": "Story status keyed by story filename",
            "additionalProperties": {
              "type": "string",
              "enum": ["planned", "in-progress", "done"]
            }
          }
        }
      }
    },
    "gates": {
      "type": "object",
      "description": "Mandatory hard gates that must be explicitly satisfied before phase transitions. In v2+ a gate may be `true` only when backed by fresh evidence in `gateEvidence`; `cadet-agent state validate` rejects unsupported claims. Reset when moving to a new work item.",
      "properties": {
        "codeReviewCompleted": {
          "type": "boolean",
          "default": false,
          "description": "Full 17-step code review per CodeReview.md completed for the current story/epic"
        },
        "testsPassed": {
          "type": "boolean",
          "default": false,
          "description": "All tests for the current work item pass (red/green cycle confirmed)"
        },
        "storyTrackingUpdated": {
          "type": "boolean",
          "default": false,
          "description": "Story and epic markdown files updated to reflect completion"
        },
        "compileCheckConfirmed": {
          "type": "boolean",
          "default": false,
          "description": "Unity compile confirmed — automated via Unity CLI, or a user manual-confirmation record"
        },
        "unityAnalyzerClean": {
          "type": "boolean",
          "default": false,
          "description": "Zero Unity analyzer diagnostics (UNT*) in changed files"
        },
        "acceptanceCriteriaValidated": {
          "type": "boolean",
          "default": false,
          "description": "Each Given/When/Then criterion validated against implementation"
        },
        "securityReviewPassed": {
          "type": "boolean",
          "default": false,
          "description": "No sensitive data, secrets, or security concerns identified"
        },
        "designArtifactSyncConfirmed": {
          "type": "boolean",
          "default": false,
          "description": "Requirements, technical design, project plan, and epics are mutually consistent"
        },
        "reachabilityAddressed": {
          "type": "boolean",
          "default": false,
          "description": "The story's declared reachability is honoured: witnessed, or deferred to a work item that exists and is not already done. Required on review→validation only when .cadet/harness.json sets reachability.enabled; verified with `cadet-agent harness verify-reachability`. Contract v6 §2."
        },
        "architectureFitnessPassed": {
          "type": "boolean",
          "default": false,
          "description": "Every required architecture check that governs the changed files ran and reported no violation. Required on implementation -> review only when `architectureFitness.enabled` is true AND at least one check is declared, so a project that declares none keeps the frozen transition lists unchanged; also re-examined at validation -> closed, because a later story can break a dependency an earlier one satisfied."
        },
        "humanAcceptanceConfirmed": {
          "type": "boolean",
          "default": false,
          "description": "A person accepted the delivered work. Human-owned: no reviewer's record and no command can stand in for them. Required on validation -> closed only, and only when humanAcceptance.enabled is true (opt-in; the shipped policy file turns it on for a new consumer). The record must carry a non-empty witness and limitations."
        },
        "designReviewCompleted": {
          "type": "boolean",
          "default": false,
          "description": "The formal design review of the design, completed before story breakdown. Required on architectureComplete -> story-breakdown only, and only when designReview.enabled is true (opt-in; the shipped policy file turns it on for a new consumer)."
        }
      }
    },
    "gateEvidence": {
      "type": "array",
      "description": "Live evidence records backing gate claims. In v4 this holds only the active work item's records — a closed work item's evidence lives in its commit trailers and `.cadet/archive/`, summarised by `evidenceCoverage`. See harness.schema.json#/$defs/evidence.",
      "items": { "$ref": "harness.schema.json#/$defs/evidence" }
    },
    "evidenceCoverage": {
      "type": "object",
      "description": "v4: per-work-item summary of evidence that is no longer inline. Regenerable from git trailers via `coverageFromSealed`, and required for the framework to keep answering 'does every done story own evidence?' after compaction.",
      "additionalProperties": { "$ref": "#/$defs/evidenceCoverageRow" }
    },
    "gateExceptions": {
      "type": "array",
      "description": "v4: the canonical home for gate exceptions, which are live state (scoped and expiring) rather than history. v1-v3 documents carry them in `changeHistory` instead; both are read, so a document validates the same either way.",
      "items": { "$ref": "#/$defs/gateException" }
    },
    "activeRunId": {
      "oneOf": [
        { "type": "string", "pattern": "^[0-9a-f]{8}-[0-9a-f]{4}-4[0-9a-f]{3}-[89ab][0-9a-f]{3}-[0-9a-f]{12}$" },
        { "type": "null" }
      ],
      "description": "v2: the run currently in progress, or null."
    },
    "activeWorkItem": {
      "oneOf": [
        {
          "type": "object",
          "properties": {
            "epicId": { "type": ["string", "null"] },
            "storyId": { "type": ["string", "null"] }
          },
          "additionalProperties": false
        },
        { "type": "null" }
      ],
      "description": "v2: the epic/story whose gates and evidence are currently authoritative. In v4 it also decides what stays inline in `gateEvidence`."
    },
    "lastTransition": {
      "oneOf": [
        {
          "type": "object",
          "required": ["from", "to", "at"],
          "properties": {
            "from": { "type": "string" },
            "to": { "type": "string" },
            "at": { "type": "string", "format": "date-time" },
            "evidenceIds": { "type": "array", "items": { "type": "string" } }
          }
        },
        { "type": "null" }
      ],
      "description": "v2: the most recent legal transition and the evidence that justified it."
    },
    "spikes": {
      "type": "object",
      "description": "Spike status keyed by spike ID",
      "additionalProperties": {
        "type": "string",
        "enum": ["planned", "in-progress", "complete"]
      }
    },
    "changeHistory": {
      "type": "array",
      "description": "The change log. **BOUNDED in v4, not retired**: eight skills record an artifact path here and `Resume` cross-checks its last entry against commit history, so removing the field would make those instructions false and take away a facility with no replacement. Bounded three ways — a transition writes no line (it is in `lastTransition` and in the sealing commit), an entry is a pointer no longer than 400 characters, and compaction keeps the most recent 25 inline while appending the overflow to `.cadet/archive/history.jsonl`. The length rule is **semantic, not per-field**: `validateState` sums the entry's text across `change`, `reason` and `rationale`, because bounding `change` alone merely relocates prose — on the audited consumer `reason` held 65% of the surviving log's bytes. The `maxLength` on `change` here is the coarse half of the same rule; the validator is authoritative and is also where the v1-v3 exemption and the live-state exemption (a legacy gate exception is never archived) live. v1-v3 documents are unchanged and keep being appended to.",
      "items": {
        "type": "object",
        "required": ["date", "change"],
        "properties": {
          "date": { "type": "string", "format": "date-time" },
          "change": { "type": "string", "maxLength": 400, "description": "A pointer, not a record: the artifact path, and the commit when there is one. The artifact says what happened, and git holds the artifact. Entries over 400 characters are an error — `cadet-agent state compact --keep active` moves them to `.cadet/archive/history.jsonl`." },
          "phase": { "type": "string" },
          "type": { "type": "string", "enum": ["gate-exception", "transition", "resume", "migration"] },
          "gate": { "type": "string" },
          "scope": { "type": "string" },
          "rationale": { "type": "string", "maxLength": 400, "description": "Part of the entry's text for the 400-character bound: `change` + `reason` + `rationale` are summed, so prose cannot be moved from one field to another to escape the limit." },
          "expiresAt": { "type": "string", "format": "date-time" },
          "category": {
            "type": "string",
            "enum": [
              "manual-compile", "budget-override", "analyzer-fallback", "unscoped-freshness",
              "documentation-only", "tooling-gap", "pre-harness-story", "non-user-facing"
            ],
            "description": "v3: required on a gate-exception under strictClosure. Determines the default expiry window and whether closureReviewNote is required. Strict closure only."
          },
          "reason": {
            "type": "string",
            "description": "v3: why the exception was needed. Strict closure only."
          },
          "closureReviewNote": {
            "type": "string",
            "description": "v3: who accepted this exception and what would change that judgement. Required for categories that are not documentation-only. Strict closure only."
          },
          "expiryExtendedReason": {
            "type": "string",
            "description": "v3: required when the exception expires beyond its category default."
          }
        }
      }
    }
  }
}
