{
  "version": 2,
  "stateVersion": 2,
  "session": {
    "workflowPath": "large",
    "currentPhase": "implementation",
    "trackingMode": "markdown"
  },
  "activeWorkItem": {
    "epicId": "epic-1-player-movement",
    "storyId": "story-1-walk.md"
  },
  "activeRunId": "9f1c5c1e-2a9b-4d0e-8f3a-6b1d2c3e4f50",
  "epics": {
    "epic-1-player-movement": {
      "status": "in-progress",
      "stories": { "story-1-walk.md": "in-progress" }
    }
  },
  "gates": { "testsPassed": false },
  "gateEvidence": [],
  "lastTransition": null,
  "spikes": {},
  "changeHistory": []
}
